<?xml version="1.0" encoding="UTF-8"?><static_text xmlns:gmr="http://www.gnome.org/gnumeric/v7" xmlns:doc="http://www.relate4u.com/xsl/documentation" xmlns:ws="http://apache.org/cocoon/source/1.0" xmlns:xsi="http://www.w3.org/2001/XMLSchema-instance" xsi:noNamespaceSchemaLocation="static_text_file_locale.xsd"><doc:asset><doc:author><doc:name>Pikachu</doc:name><doc:company>Philips, Eindhoven</doc:company><doc:email>pikachu.b2b.support@philips.com</doc:email></doc:author><doc:description>
                  Static text file for Philips Lighting product brochures XSL-FO stylesheet.
                  This file contains translated static text fields which are not available in the product XML files.
                  Last updated: 2011-03-01T11:02:32.338+01:00</doc:description><doc:language>it_IT</doc:language><doc:document-type>FMT</doc:document-type></doc:asset><fields><field id="date_change">Dati soggetti a modifiche</field><field id="copyright_royal">Koninklijke Philips Electronics N.V.</field><field id="copyright_text">Tutti i diritti riservati.<br/>
<br/>
Le specifiche sono soggette a modifica senza previa notifica. Trademarks are the property of Koninklijke Philips Electronics N.V. or their respective owners.<br/>
<br/>
<b>www.philips.com/lighting</b></field><field id="dimensionaldrawing">Disegno tecnico</field><field id="photometricdata">Fotometrie</field><field id="month_1">Gennaio</field><field id="month_2">Febbraio</field><field id="month_3">Marzo</field><field id="month_4">Aprile</field><field id="month_5">Maggio</field><field id="month_6">Giugno</field><field id="month_7">Luglio</field><field id="month_8">Agosto</field><field id="month_9">Settembre</field><field id="month_10">Ottobre</field><field id="month_11">Novembre</field><field id="month_12">Dicembre</field><field id="benefits">Vantaggi</field><field id="features">Caratteristiche</field><field id="application">Applicazione</field><field id="specifications">Specifiche </field><field id="relatedproducts">Prodotti collegati</field><field id="accessories">Accessori</field><field id="spectralpowerdistribution">Distribuzione spettrale della luce</field><field id="performancediagram">Diagramma prestazionale</field><field id="crvdiagram">Diagramma CRV</field><field id="comparetable">Tavolo Confronto</field><field id="productdetails">Dati del prodotto</field><field id="warningssafety">Warnings and safety</field></fields></static_text>