<?xml version="1.0" encoding="UTF-8"?><static_text xmlns:gmr="http://www.gnome.org/gnumeric/v7" xmlns:doc="http://www.relate4u.com/xsl/documentation" xmlns:ws="http://apache.org/cocoon/source/1.0" xmlns:xsi="http://www.w3.org/2001/XMLSchema-instance" xsi:noNamespaceSchemaLocation="static_text_file_locale.xsd"><doc:asset><doc:author><doc:name>Pikachu</doc:name><doc:company>Philips, Eindhoven</doc:company><doc:email>pikachu.b2b.support@philips.com</doc:email></doc:author><doc:description>
                  Static text file for Philips Lighting product brochures XSL-FO stylesheet.
                  This file contains translated static text fields which are not available in the product XML files.
                  Last updated: 2011-03-01T11:02:32.338+01:00</doc:description><doc:language>da_DK</doc:language><doc:document-type>FMT</doc:document-type></doc:asset><fields><field id="date_change">registrerede til at ændre</field><field id="copyright_royal">Koninklijke Philips Electronics N.V.</field><field id="copyright_text">Alle rettigheder reserved.<br/>
<br/>
Specifications kan ændres uden varsel. Varemærker tilhører Koninklijke Philips Electronics NV eller deres respektive ejere.<br/>
<br/>
<b>www.philips.com/lighting</b></field><field id="dimensionaldrawing">Målskitse</field><field id="photometricdata">Fotometriske data</field><field id="month_1">januar</field><field id="month_2">februar</field><field id="month_3">marts</field><field id="month_4">april</field><field id="month_5">maj</field><field id="month_6">juni</field><field id="month_7">juli</field><field id="month_8">august</field><field id="month_9">september</field><field id="month_10">oktober</field><field id="month_11">november</field><field id="month_12">december</field><field id="benefits">Fordele</field><field id="features">Funktioner</field><field id="application">Ansøgning</field><field id="specifications">Specifikationer</field><field id="relatedproducts">Relaterede produkter</field><field id="accessories">Tilbehør</field><field id="spectralpowerdistribution">Spektral effekttæthed distribution</field><field id="performancediagram">Præstation diagram</field><field id="crvdiagram">CRV diagram</field><field id="comparetable">Sammenlign tabel</field><field id="productdetails">Oplysninger om produktet</field><field id="warningssafety">Advarsler og sikkerhed</field></fields></static_text>