<?xml version="1.0" encoding="UTF-8"?><static_text xmlns:gmr="http://www.gnome.org/gnumeric/v7" xmlns:doc="http://www.relate4u.com/xsl/documentation" xmlns:ws="http://apache.org/cocoon/source/1.0" xmlns:xsi="http://www.w3.org/2001/XMLSchema-instance" xsi:noNamespaceSchemaLocation="static_text_file_locale.xsd"><doc:asset><doc:author><doc:name>Pikachu</doc:name><doc:company>Philips, Eindhoven</doc:company><doc:email>pikachu.b2b.support@philips.com</doc:email></doc:author><doc:description>
                  Static text file for Philips Lighting product brochures XSL-FO stylesheet.
                  This file contains translated static text fields which are not available in the product XML files.
                  Last updated: 2011-03-01T11:02:32.338+01:00</doc:description><doc:language>hu_HU</doc:language><doc:document-type>FMT</doc:document-type></doc:asset><fields><field id="date_change">az adatok változhatnak</field><field id="copyright_royal">Koninklijke Philips Electronics N.V.</field><field id="copyright_text">Minden jog fenntartva.<br/>
<br/>
A műszaki adatok előzetes figyelmeztetés nélkül változhatnak. Minden védjegy a Koninklijke Philips Electronics N.V. céget, vagy az illető jogtulajdonost illeti.<br/>
<br/>
<b>www.philips.com/lighting</b></field><field id="dimensionaldrawing">Méretezett rajza</field><field id="photometricdata">Fotometriai adatok</field><field id="month_1">Január</field><field id="month_2">Február</field><field id="month_3">Március</field><field id="month_4">Április</field><field id="month_5">Május</field><field id="month_6">Június</field><field id="month_7">Július</field><field id="month_8">Augusztus</field><field id="month_9">Szeptember</field><field id="month_10">Október</field><field id="month_11">November</field><field id="month_12">December</field><field id="benefits">Előnyök</field><field id="features">Szolgáltatások</field><field id="application">Alkalmazás</field><field id="specifications">termékjellemzők</field><field id="relatedproducts">Kapcsolódó termékek</field><field id="accessories">Tartozékok</field><field id="spectralpowerdistribution">Spektrális teljesítmény eloszlása</field><field id="performancediagram">Teljesítmény diagram</field><field id="crvdiagram">CRV diagram</field><field id="comparetable">Hasonlítsa össze a tábla</field><field id="productdetails">Termék részletei</field><field id="warningssafety">Figyelmeztetések és biztonság</field></fields></static_text>