<?xml version="1.0" encoding="UTF-8"?><static_text xmlns:gmr="http://www.gnome.org/gnumeric/v7" xmlns:doc="http://www.relate4u.com/xsl/documentation" xmlns:ws="http://apache.org/cocoon/source/1.0" xmlns:xsi="http://www.w3.org/2001/XMLSchema-instance" xsi:noNamespaceSchemaLocation="static_text_file_locale.xsd"><doc:asset><doc:author><doc:name>Pikachu</doc:name><doc:company>Philips, Eindhoven</doc:company><doc:email>pikachu.b2b.support@philips.com</doc:email></doc:author><doc:description>
                  Static text file for Philips Lighting product brochures XSL-FO stylesheet.
                  This file contains translated static text fields which are not available in the product XML files.
                  Last updated: 2011-03-01T11:02:32.338+01:00</doc:description><doc:language>ro_RO</doc:language><doc:document-type>FMT</doc:document-type></doc:asset><fields><field id="date_change">Informatie ce poate fi modificată</field><field id="copyright_royal">Koninklijke Philips Electronics N.V.</field><field id="copyright_text">Toate drepturile rezervate.<br/>
<br/>
Specificaţiile pot fi schimbate fără notificare. Informaţiile constituie proprietatea Koninklijke Philips Electronics N.V. <br/>
<br/>
<b>www.philips.com/lighting</b></field><field id="dimensionaldrawing">Cote</field><field id="photometricdata">Date fotometrice</field><field id="month_1">Ianuarie</field><field id="month_2">Februarie</field><field id="month_3">Martie</field><field id="month_4">Aprilie</field><field id="month_5">Mai</field><field id="month_6">Iunie</field><field id="month_7">Iulie</field><field id="month_8">August</field><field id="month_9">Septembrie</field><field id="month_10">Octombrie</field><field id="month_11">Noiembrie</field><field id="month_12">Decembrie</field><field id="benefits">Beneficii</field><field id="features">Caracteristici</field><field id="application">Cerere</field><field id="specifications">Specificaţii</field><field id="relatedproducts">Produse similare</field><field id="accessories">Accesorii</field><field id="spectralpowerdistribution">Distribuţia puterii spectrale</field><field id="performancediagram">Diagrama de performanţă</field><field id="crvdiagram">Diagrama CRV</field><field id="comparetable">Compara tabel</field><field id="productdetails">Detalii produs</field><field id="warningssafety">Warnings and safety</field></fields></static_text>