<?xml version="1.0" encoding="UTF-8"?><static_text xmlns:gmr="http://www.gnome.org/gnumeric/v7" xmlns:doc="http://www.relate4u.com/xsl/documentation" xmlns:ws="http://apache.org/cocoon/source/1.0" xmlns:xsi="http://www.w3.org/2001/XMLSchema-instance" xsi:noNamespaceSchemaLocation="static_text_file_locale.xsd"><doc:asset><doc:author><doc:name>Pikachu</doc:name><doc:company>Philips, Eindhoven</doc:company><doc:email>pikachu.b2b.support@philips.com</doc:email></doc:author><doc:description>
                  Static text file for Philips Lighting product brochures XSL-FO stylesheet.
                  This file contains translated static text fields which are not available in the product XML files.
                  Last updated: 2011-03-01T11:02:32.338+01:00</doc:description><doc:language>sk_SK</doc:language><doc:document-type>FMT</doc:document-type></doc:asset><fields><field id="date_change">Údaje podliehajú zmenám</field><field id="copyright_royal">Koninklijke Philips Electronics N.V.</field><field id="copyright_text">Všetky práva vyhradené.<br/>
<br/>
Špecifikácia podlieha zmenám bez predchádzajúceho upozornenia. Obchodné značky sú majetkom Koninklijke Philips Electronics N.V. alebo jej príslušných majiteľiv..<br/>
<br/>
<b>www.philips.com/lighting</b></field><field id="dimensionaldrawing">Rozmerový obrázok</field><field id="photometricdata">Fotometrické údaje</field><field id="month_1">Január</field><field id="month_2">Február</field><field id="month_3">Marec</field><field id="month_4">Apríl</field><field id="month_5">Máj</field><field id="month_6">Jún</field><field id="month_7">Júl</field><field id="month_8">August</field><field id="month_9">September</field><field id="month_10">Október</field><field id="month_11">November</field><field id="month_12">December</field><field id="benefits">Výhody</field><field id="features">Vlastnosti</field><field id="application">Aplikácie</field><field id="specifications">Špecifikácia</field><field id="relatedproducts">Príbuzné produkty</field><field id="accessories">Príslušenstvo</field><field id="spectralpowerdistribution">Spektrálne rozloženie</field><field id="performancediagram">Krivka účinnosti</field><field id="crvdiagram">CRV krivka</field><field id="comparetable">Porovnať tabuľka</field><field id="productdetails">Podrobnosti o produkte</field><field id="warningssafety">Varovanie a ochrana</field></fields></static_text>