<?xml version="1.0" encoding="UTF-8"?><static_text xmlns:gmr="http://www.gnome.org/gnumeric/v7" xmlns:doc="http://www.relate4u.com/xsl/documentation" xmlns:ws="http://apache.org/cocoon/source/1.0" xmlns:xsi="http://www.w3.org/2001/XMLSchema-instance" xsi:noNamespaceSchemaLocation="static_text_file_locale.xsd"><doc:asset><doc:author><doc:name>Pikachu</doc:name><doc:company>Philips, Eindhoven</doc:company><doc:email>pikachu.b2b.support@philips.com</doc:email></doc:author><doc:description>
                  Static text file for Philips Lighting product brochures XSL-FO stylesheet.
                  This file contains translated static text fields which are not available in the product XML files.
                  Last updated: 2011-03-01T11:02:32.338+01:00</doc:description><doc:language>es_ES</doc:language><doc:document-type>FMT</doc:document-type></doc:asset><fields><field id="date_change">Datos sujetos a cambios</field><field id="copyright_royal">Koninklijke Philips Electronics N.V.</field><field id="copyright_text">Todos los derechos reservados.<br/>
<br/>
Las especificaciones están sujetas a cambios sin previo aviso. Las marcas registradas son propiedad de Koninklijke Philips Electronics N.V. o de sus respectivos propietarios.<br/>
<br/>
<b>www.philips.com/lighting</b></field><field id="dimensionaldrawing">Plano de dimensiones</field><field id="photometricdata">Datos fotométricos</field><field id="month_1">Enero</field><field id="month_2">Febrero</field><field id="month_3">Marzo</field><field id="month_4">Abril</field><field id="month_5">Mayo</field><field id="month_6">Junio</field><field id="month_7">Julio</field><field id="month_8">Agosto</field><field id="month_9">Septiembre</field><field id="month_10">Octubre</field><field id="month_11">Noviembre</field><field id="month_12">Diciembre</field><field id="benefits">Beneficios</field><field id="features">Características</field><field id="application">Aplicaciones</field><field id="specifications">Especificaciones</field><field id="relatedproducts">Productos relacionados</field><field id="accessories">Accesorios</field><field id="spectralpowerdistribution">Distribución de potencia espectral</field><field id="performancediagram">Diagrama de rendimiento</field><field id="crvdiagram">Diagrama de CRV</field><field id="comparetable">Tabla comparativa</field><field id="productdetails">Detalles del producto</field><field id="warningssafety">Advertencias y seguridad</field></fields></static_text>