<?xml version="1.0" encoding="UTF-8"?><static_text xmlns:gmr="http://www.gnome.org/gnumeric/v7" xmlns:doc="http://www.relate4u.com/xsl/documentation" xmlns:ws="http://apache.org/cocoon/source/1.0" xmlns:xsi="http://www.w3.org/2001/XMLSchema-instance" xsi:noNamespaceSchemaLocation="static_text_file_locale.xsd"><doc:asset><doc:author><doc:name>Pikachu</doc:name><doc:company>Philips, Eindhoven</doc:company><doc:email>pikachu.b2b.support@philips.com</doc:email></doc:author><doc:description>
                  Static text file for Philips Lighting product brochures XSL-FO stylesheet.
                  This file contains translated static text fields which are not available in the product XML files.
                  Last updated: 2011-03-01T11:02:32.338+01:00</doc:description><doc:language>pt_PT</doc:language><doc:document-type>FMT</doc:document-type></doc:asset><fields><field id="date_change">Dados sujeitos a alteração</field><field id="copyright_royal">Koninklijke Philips Electronics N.V.</field><field id="copyright_text">Todos os direitos reservados<br/>
<br/>
As especificações estão sujeitas a alterações sem aviso prévio. As marcas comerciais são propriedade de Koninklijke Philips Electronics NV ou de seus respectivos proprietários.<br/>
<br/>
<b>www.philips.com/lighting</b></field><field id="dimensionaldrawing">Desenho dimensional</field><field id="photometricdata">Dados fotométricos</field><field id="month_1">Janeiro</field><field id="month_2">Fevereiro</field><field id="month_3">Março</field><field id="month_4">Abril</field><field id="month_5">Maio</field><field id="month_6">Junho</field><field id="month_7">Julho</field><field id="month_8">Agosto</field><field id="month_9">Setembro</field><field id="month_10">Outubro</field><field id="month_11">Novembro</field><field id="month_12">Dezembro</field><field id="benefits">Benefícios</field><field id="features">Características</field><field id="application">Aplicação</field><field id="specifications">Especificações</field><field id="relatedproducts">Produtos relacionados</field><field id="accessories">Acessórios</field><field id="spectralpowerdistribution">Distribuição de energia espectral</field><field id="performancediagram">Diagrama de desempenho</field><field id="crvdiagram">Diagrama CRV</field><field id="comparetable">Compare preços de tabela</field><field id="productdetails">Detalhes do produto</field><field id="warningssafety">Avisos e Segurança</field></fields></static_text>