<?xml version="1.0" encoding="UTF-8"?><static_text xmlns:gmr="http://www.gnome.org/gnumeric/v7" xmlns:doc="http://www.relate4u.com/xsl/documentation" xmlns:ws="http://apache.org/cocoon/source/1.0" xmlns:xsi="http://www.w3.org/2001/XMLSchema-instance" xsi:noNamespaceSchemaLocation="static_text_file_locale.xsd"><doc:asset><doc:author><doc:name>Pikachu</doc:name><doc:company>Philips, Eindhoven</doc:company><doc:email>pikachu.b2b.support@philips.com</doc:email></doc:author><doc:description>
                  Static text file for Philips Lighting product brochures XSL-FO stylesheet.
                  This file contains translated static text fields which are not available in the product XML files.
                  Last updated: 2011-03-01T11:02:32.338+01:00</doc:description><doc:language>tr_TR</doc:language><doc:document-type>FMT</doc:document-type></doc:asset><fields><field id="date_change">Bilgi değişimi</field><field id="copyright_royal">Koninklijke Philips Electronics N.V.</field><field id="copyright_text">Tüm hakları saklıdır.<br/>
<br/>
Teknik özellikler önceden bildirilmeksizin değiştirilebilir. Ticari markalar Koninklijke Philips Electronics N.V. veya ilgili sahiplerine aittir.<br/>
<br/>
<b>www.philips.com/lighting</b></field><field id="dimensionaldrawing">Boyutlu çizim</field><field id="photometricdata">Fotometrik bilgi</field><field id="month_1">Ocak</field><field id="month_2">Şubat</field><field id="month_3">Mart</field><field id="month_4">Nisan</field><field id="month_5">Mayıs</field><field id="month_6">Haziran</field><field id="month_7">Temmuz</field><field id="month_8">Ağustos</field><field id="month_9">Eylül</field><field id="month_10">Ekim</field><field id="month_11">Kasım</field><field id="month_12">Aralık</field><field id="benefits">Faydaları</field><field id="features">Özellikler</field><field id="application">Uygulama</field><field id="specifications">şartlar</field><field id="relatedproducts">İlgili ürünler</field><field id="accessories">aksesuarlar</field><field id="spectralpowerdistribution">Spektral Güç Dağılımı</field><field id="performancediagram">Performans diyagramı</field><field id="crvdiagram">CRV Diyagramı</field><field id="comparetable">Karşılaştırmak tablo</field><field id="productdetails">ÜRÜN BİLGİLERİ</field><field id="warningssafety">Güvenlik ve uyarılar</field></fields></static_text>